{
  "schema_version": "0.1",
  "skill_id": "agent-evaluation-design-and-regression",
  "display_name": "Agent Evaluation Design And Regression",
  "version": "1.0.0",
  "description": "Design and analyze bounded agent task/trajectory evaluations and regression comparisons using authorized evidence.",
  "capability_category": "agent_evaluation_design_and_regression",
  "provenance": {
    "author": "LiNKskills Library",
    "source": "Pinned upstream modules copied with licenses and exact commit identities; see references/upstream/SOURCE-MANIFEST.json",
    "license": "See per-source upstream license copies and manifest"
  },
  "lifecycle_state": "draft",
  "format_profile": "heavy",
  "compatible_runtime_profiles": [
    "lisa-openclaw",
    "cursor-macos"
  ],
  "min_capability_tier": "balanced",
  "routing": {
    "when_to_use": "Design and analyze bounded agent task/trajectory evaluations and regression comparisons using authorized evidence.",
    "when_not_to_use": [
      "A different task requires its own skill",
      "Unapproved consequential action",
      "Unauthorized evidence or audience"
    ],
    "tags": [
      "operations",
      "task-specific",
      "sara"
    ],
    "exclusion_rules": [
      "Missing facts block the affected conclusion, not harmless drafting"
    ],
    "ambiguity_rules": [
      "Read existing authorized evidence first; ask only material unanswered questions"
    ],
    "recommended_disclosure_level": 2
  },
  "execution": {
    "required_inputs": [
      {
        "name": "task_inputs",
        "description": "evaluation decision and risk; candidate/baseline identities and comparable run settings; authorized immutable cases and provenance; task/trajectory/side-effect contracts; observed results and approved cost budget"
      }
    ],
    "expected_outputs": [
      {
        "name": "work_product",
        "description": "versioned evaluation plan and dataset manifest; grader specification and observable assertions; per-case and per-dimension comparison with uncertainty; regression and blocked-environment report; owner decision, gaps and redacted monitoring plan"
      }
    ],
    "forbidden_actions": [
      "Unapproved payments, filings, postings, signatures, purchases, external announcements or production changes",
      "Inventing source facts, approval or canon",
      "Accessing unrelated private history"
    ],
    "verification_steps": [
      "Define the decision, target outcomes, task and trajectory contracts, forbidden side effects and risk before drafting cases. Select evidence by harm and reversibility; do not require one execution path where several valid paths satisfy the contract.",
      "Freeze a versioned dataset with rights/consent, provenance, fixtures, expected side effects, contamination controls, retention, slices and limitations. Include representative happy, edge, adversarial and actual regression cases; fictional probes are labeled and do not represent production prevalence.",
      "Choose the smallest adequate deterministic checks for observable structure, figures, permitted tools and final state; use environment/side-effect checks where schema cannot prove behavior. Route subjective judge design/calibration to agent-judge-calibration rather than invent a trustworthy scalar score.",
      "Compare candidate and baseline under the same realistic context, tool, token and run conditions. Record repeats when variability changes the decision, observed trajectories, timeouts and environment/access failures; no model/paid execution without its existing authorization and budget.",
      "Report paired per-case regressions, dimension and complexity-slice scores, denominators/missingness, effect and uncertainty alongside measured cost and P50/P95 latency. Failed environment cases remain visible separately; excluding them requires an explicit reason and must not inflate the behavioral pass claim.",
      "Apply independent hard safety/privacy/authorization/side-effect gates that cannot be averaged away. Non-significance is not equivalence, repeated identical text is not effectiveness, and structural PASS covers only structure. Record the actual approval owner and insufficient-evidence outcome.",
      "Use minimized redacted owner telemetry to monitor comparable production signals and turn verified failures into frozen regression cases after consent/transformation review. Re-evaluate relevant tests after model, prompt or tool changes; do not rewrite cases just to pass or impose a universal case count."
    ],
    "completion_criteria": [
      "Task output meets contract and task-specific acceptance criteria",
      "Sources, uncertainty, exact completion scope and remaining decisions visible",
      "Any authorized draft write read back"
    ],
    "known_limitations": [
      "Structural qualification does not prove every behavior",
      "Source originals are provenance; canonical method owns execution",
      "Specialist content/draft access may be Sara-mediated"
    ]
  },
  "dependencies": {
    "schema_version": "0.1",
    "skill_dependencies": [],
    "packaged_tools": [],
    "host_capabilities": [
      "filesystem_read",
      "filesystem_write",
      "network"
    ],
    "external_services": [],
    "library_assets": [],
    "runtime_requirements": [
      {
        "key": "min_reasoning_tier",
        "value": "balanced"
      },
      {
        "key": "context_required",
        "value": 128000
      },
      {
        "key": "preferred_model",
        "value": "gpt-6.1-sol"
      }
    ],
    "optional_dependencies": []
  },
  "eval": {
    "suite_path": "references/eval-suite.json",
    "suite_schema_version": "0.1",
    "required_certification_profiles": [],
    "verification_refs": [
      "references/eval-suite.yaml",
      "references/source-selection.md"
    ]
  },
  "telemetry": {
    "classification": "restricted",
    "redaction_rules": [
      "strip_secrets",
      "strip_personal_data",
      "strip_private_finance_tax_and_vendor_data",
      "strip_raw_documents",
      "strip_reasoning"
    ],
    "retention_policy": "retain opaque task/source ids and hashes only"
  },
  "fragments": [
    {
      "fragment_id": "skill-md",
      "disclosure_level": 2,
      "path": "SKILL.md"
    },
    {
      "fragment_id": "advanced",
      "disclosure_level": 3,
      "path": "advanced/advanced.md"
    },
    {
      "fragment_id": "schemas",
      "disclosure_level": 5,
      "path": "references/schemas.json"
    },
    {
      "fragment_id": "source-selection",
      "disclosure_level": 3,
      "path": "references/source-selection.md"
    },
    {
      "fragment_id": "api",
      "disclosure_level": 3,
      "path": "references/api-specs.md"
    }
  ],
  "release_channel": "development"
}
