{
  "schema_version": "0.1",
  "skill_id": "self-critique-loop",
  "display_name": "Self Critique Loop",
  "version": "1.0.0",
  "description": "Runs a System 2 audit loop that stress-tests draft outputs for correctness, consistency, and risk before release.",
  "capability_category": "internal_launch",
  "lifecycle_state": "draft",
  "format_profile": "heavy",
  "compatible_runtime_profiles": [
    "cursor-macos"
  ],
  "min_capability_tier": "high",
  "routing": {
    "when_to_use": "Use before finalizing high-impact outputs to force structured self-critique and error correction.",
    "when_not_to_use": [
      "Do not skip critique phase for speed",
      "Do not suppress detected errors without remediation notes"
    ],
    "tags": [
      "quality",
      "audit",
      "system-2"
    ]
  },
  "execution": {
    "required_inputs": [
      {
        "name": "task",
        "description": "Operator task"
      }
    ],
    "expected_outputs": [
      {
        "name": "result",
        "description": "Scoped skill result"
      }
    ],
    "forbidden_actions": [
      "Publish without an issuer-sealed receipt",
      "Grant permission-to-act"
    ],
    "verification_steps": [
      "Run the confined eval suite",
      "Confirm cursor-macos is declared"
    ],
    "completion_criteria": [
      "Canonical skill pack and execution profile match this version"
    ]
  },
  "dependencies": {
    "schema_version": "0.1",
    "skill_dependencies": [],
    "packaged_tools": [],
    "host_capabilities": [
      "filesystem_read"
    ],
    "external_services": [],
    "library_assets": [],
    "runtime_requirements": [],
    "optional_dependencies": []
  },
  "eval": {
    "suite_path": "references/eval-suite.json",
    "suite_schema_version": "0.1",
    "suite_hash": "sha256:e803184db4434ec11835e43ae68dcb6ea79c555147a4368336e182455df5a959"
  },
  "telemetry": {
    "classification": "public_internal",
    "redaction_rules": [
      "strip_secrets",
      "strip_reasoning"
    ],
    "retention_policy": "retain_ids_and_hashes"
  },
  "release_channel": "eval"
}
