{
  "schema_version": "0.1",
  "skill_id": "legal-ip-oss-review",
  "display_name": "Legal Ip Oss Review",
  "version": "0.1.0",
  "description": "Review the exact open-source components, versions, license texts, usage modes, modifications, distribution and linking/deployment architecture supplied. Prepare a task-specific, evidence-linked draft and identify unresolved facts, owners and next steps.",
  "capability_category": "ip_oss_review",
  "lifecycle_state": "draft",
  "format_profile": "heavy",
  "compatible_runtime_profiles": [
    "lisa-openclaw",
    "cursor-macos"
  ],
  "min_capability_tier": "balanced",
  "provenance": {
    "author": "LiNKskills adaptation",
    "source": "Complete pinned upstream task tree and notices retained byte-for-byte in references/upstream/SOURCE-MANIFEST.json",
    "license": "Exact source notices and license evidence are preserved per source; Carlos handles licensing."
  },
  "routing": {
    "when_to_use": "Review the exact open-source components, versions, license texts, usage modes, modifications, distribution and linking/deployment architecture supplied. Return the draft, evidence trace, and uncertainties.",
    "when_not_to_use": [
      "A different, distinct task is requested",
      "An unapproved external effect, final decision, signature or system mutation is required"
    ],
    "tags": [
      "sara",
      "task-specific",
      "draft"
    ],
    "exclusion_rules": [
      "No invented company facts, policy, law, authority, approval or jurisdiction",
      "Foreign jurisdiction material is conditional and not generalized"
    ],
    "ambiguity_rules": [
      "Read authorized evidence; ask only materially outcome-changing questions; complete separable work"
    ],
    "recommended_disclosure_level": 2
  },
  "execution": {
    "required_inputs": [
      {
        "name": "task_request",
        "description": "Exact requested deliverable and boundaries."
      },
      {
        "name": "source_documents",
        "description": "Authorized document, record, or evidence references."
      },
      {
        "name": "company_or_matter_facts",
        "description": "Founder-confirmed facts and company/matter context; unknowns remain explicit."
      },
      {
        "name": "jurisdiction_and_as_of",
        "description": "Only actual jurisdiction(s) supplied or established from authoritative evidence, plus as-of date. Null when not applicable/known."
      },
      {
        "name": "approved_positions_or_policy_ref",
        "description": "Approved policy/playbook/position reference, if supplied; absence is not permission to invent one."
      },
      {
        "name": "legal_ip_oss_review_task_payload",
        "description": "Required task-specific fields: component_and_version_inventory, license_and_notice_files, distribution_and_use_mode, build_or_release_scope_and_missing_evidence. Every field carries fact_status, value, and evidence_refs; use fact_status=unknown with null value when the evidence is unavailable."
      }
    ],
    "expected_outputs": [
      {
        "name": "legal_ip_oss_review_work_product",
        "description": "Produce the source task deliverable stated in the entrypoint, marked as a draft where approval is needed; upstream Markdown does not declare interoperable typed LiNKskills output fields. Produce this task\u2019s distinct requested artifact."
      }
    ],
    "forbidden_actions": [
      "Unapproved external effects, signatures, filings, legal commitments or source-system mutations",
      "Inventing facts, jurisdiction, legal authority, company policy or approval",
      "Exposure of confidential or personal data outside authorized scope"
    ],
    "verification_steps": [
      "Check every material conclusion against evidence and record source/date/location.",
      "Distinguish fact, allegation, interpretation, proposal and unknown.",
      "Verify jurisdiction-specific current primary authority where legal conclusion depends on law; otherwise report the precise gap.",
      "Validate task contract and keep external_effects and mutations empty.",
      "Use only current visible native tool schemas; report unsupported interface gaps."
    ],
    "completion_criteria": [
      "Distinct task deliverable meets typed contract and task-specific acceptance criteria",
      "Evidence, date/applicability, uncertainty and reviewer/owner decisions are visible",
      "No unapproved external effects or mutations"
    ],
    "known_limitations": [
      "Draft and uncertified; structural checks are not semantic or legal certification",
      "No current legal database or business interface is assumed"
    ]
  },
  "dependencies": {
    "schema_version": "0.1",
    "skill_dependencies": [],
    "packaged_tools": [],
    "host_capabilities": [
      "filesystem_read",
      "filesystem_write"
    ],
    "external_services": [],
    "library_assets": [],
    "runtime_requirements": [
      {
        "key": "min_reasoning_tier",
        "value": "balanced"
      },
      {
        "key": "context_required",
        "value": 64000
      },
      {
        "key": "preferred_model",
        "value": "gpt-6.1-sol"
      }
    ],
    "optional_dependencies": []
  },
  "eval": {
    "suite_path": "references/eval-suite.json",
    "suite_schema_version": "0.1",
    "required_certification_profiles": [],
    "verification_refs": [
      "references/eval-suite.yaml",
      "references/upstream/SOURCE-MANIFEST.json"
    ],
    "suite_hash": "sha256:9cb65f7607484167dc0d34ec50d0ff14d5cc461119564a22b4702470e3bd9386"
  },
  "telemetry": {
    "classification": "restricted",
    "redaction_rules": [
      "strip_secrets",
      "strip_personal_data",
      "strip_raw_documents",
      "strip_reasoning"
    ],
    "retention_policy": "opaque task/source ids and hashes only"
  },
  "fragments": [
    {
      "fragment_id": "gitignore",
      "disclosure_level": 3,
      "path": ".gitignore"
    },
    {
      "fragment_id": "skill_md",
      "disclosure_level": 2,
      "path": "SKILL.md"
    },
    {
      "fragment_id": "advanced_advanced_md",
      "disclosure_level": 2,
      "path": "advanced/advanced.md"
    },
    {
      "fragment_id": "examples_error_recovery_md",
      "disclosure_level": 3,
      "path": "examples/error-recovery.md"
    },
    {
      "fragment_id": "examples_success_pattern_md",
      "disclosure_level": 3,
      "path": "examples/success-pattern.md"
    },
    {
      "fragment_id": "examples_synthetic_example_md",
      "disclosure_level": 3,
      "path": "examples/synthetic-example.md"
    },
    {
      "fragment_id": "references_api_specs_md",
      "disclosure_level": 3,
      "path": "references/api-specs.md"
    },
    {
      "fragment_id": "references_changelog_md",
      "disclosure_level": 3,
      "path": "references/changelog.md"
    },
    {
      "fragment_id": "references_eval_suite_json",
      "disclosure_level": 3,
      "path": "references/eval-suite.json"
    },
    {
      "fragment_id": "references_eval_suite_yaml",
      "disclosure_level": 3,
      "path": "references/eval-suite.yaml"
    },
    {
      "fragment_id": "references_execution_profile_json",
      "disclosure_level": 3,
      "path": "references/execution-profile.json"
    },
    {
      "fragment_id": "references_old_patterns_md",
      "disclosure_level": 3,
      "path": "references/old-patterns.md"
    },
    {
      "fragment_id": "references_schemas_json",
      "disclosure_level": 3,
      "path": "references/schemas.json"
    },
    {
      "fragment_id": "references_source_applicability_md",
      "disclosure_level": 3,
      "path": "references/source-applicability.md"
    },
    {
      "fragment_id": "references_upstream_source_manifest_json",
      "disclosure_level": 3,
      "path": "references/upstream/SOURCE-MANIFEST.json"
    },
    {
      "fragment_id": "references_upstream_anthropics_claude_for_legal_notices_license",
      "disclosure_level": 3,
      "path": "references/upstream/anthropics-claude-for-legal/_notices/LICENSE"
    },
    {
      "fragment_id": "references_upstream_anthropics_claude_for_legal_ip_legal_skills_oss_review_skill_md",
      "disclosure_level": 3,
      "path": "references/upstream/anthropics-claude-for-legal/ip-legal/skills/oss-review/SKILL.md"
    },
    {
      "fragment_id": "references_upstream_anthropics_claude_for_legal_context_ip_legal_claude_md",
      "disclosure_level": 3,
      "path": "references/upstream/anthropics-claude-for-legal-context/ip-legal/CLAUDE.md"
    },
    {
      "fragment_id": "scripts_readme_md",
      "disclosure_level": 3,
      "path": "scripts/README.md"
    },
    {
      "fragment_id": "scripts_helper_tool_py",
      "disclosure_level": 3,
      "path": "scripts/helper_tool.py"
    }
  ],
  "release_channel": "development"
}
