{
  "schema_version": "0.1",
  "skill_id": "legal-product-is-this-a-problem",
  "display_name": "Rapid Product/Legal Concern Triage",
  "version": "0.1.1",
  "description": "Prepare a draft rapid product/legal concern triage from authorized evidence, keeping scope and applicability conditional.",
  "capability_category": "legal_product_is_this_a_problem",
  "provenance": {
    "author": "LiNKskills adaptation",
    "source": "Pinned source methodology and complete selected support/license subtree preserved with per-file hashes in references/upstream/SOURCE-MANIFEST.json",
    "license": "See exact per-source license copy and declared term in SOURCE-MANIFEST.json; no independent publication clearance or license opinion asserted."
  },
  "lifecycle_state": "draft",
  "format_profile": "heavy",
  "compatible_runtime_profiles": [
    "lisa-openclaw",
    "cursor-macos"
  ],
  "min_capability_tier": "balanced",
  "routing": {
    "when_to_use": "Prepare a draft rapid product/legal concern triage from authorized evidence, keeping scope and applicability conditional.",
    "when_not_to_use": [
      "A dedicated adjacent pack owns a materially different output or legal regime",
      "The task requires a final legal decision, certification, official action or unsupported current-law conclusion"
    ],
    "tags": [
      "sara-legal-corporate",
      "task-specific",
      "draft"
    ],
    "exclusion_rules": [
      "Source applicability is conditional; verify current law/standard and company facts",
      "No unapproved external effects or official record mutations"
    ],
    "ambiguity_rules": [
      "Read authorized supplied evidence first; ask only for material facts; complete separable work"
    ],
    "recommended_disclosure_level": 2
  },
  "execution": {
    "required_inputs": [
      {
        "name": "task_request",
        "description": "Exact requested task and boundaries."
      },
      {
        "name": "source_documents",
        "description": "Authorized source documents and records."
      },
      {
        "name": "company_context",
        "description": "Confirmed organization/product/matter facts; unknowns explicit."
      },
      {
        "name": "applicability_context",
        "description": "Jurisdiction, role, scope/version and as-of date; unknown if not established."
      },
      {
        "name": "review_owner",
        "description": "Reviewer/decision-owner role."
      },
      {
        "name": "task_request",
        "description": "Exact task and requested draft/analysis."
      },
      {
        "name": "source_documents",
        "description": "Authorized source documents/records; use an empty list only when the task is source-free."
      },
      {
        "name": "company_context",
        "description": "Confirmed company, product, matter or program facts; mark unknowns."
      },
      {
        "name": "applicability_context",
        "description": "Jurisdiction, scope, actor role, standard version and as-of date, or explicitly unknown."
      },
      {
        "name": "review_owner",
        "description": "Reviewer or decision-owner role, if known."
      },
      {
        "name": "scenario",
        "description": "Question or behavior to triage."
      },
      {
        "name": "facts_and_evidence",
        "description": "Known facts, user impact, timing and supporting materials."
      },
      {
        "name": "product_context",
        "description": "Feature, market, claims and existing controls."
      },
      {
        "name": "requested_decision",
        "description": "Fast signal, deeper review or specific follow-up."
      },
      {
        "name": "calibration_and_law",
        "description": "Approved internal calibration and current legal sources, if supplied."
      }
    ],
    "expected_outputs": [
      {
        "name": "triage_signal",
        "description": "Task-specific draft field: triage signal"
      },
      {
        "name": "basis_and_uncertainty",
        "description": "Task-specific draft field: basis and uncertainty"
      },
      {
        "name": "next_review_step",
        "description": "Task-specific draft field: next review step"
      },
      {
        "name": "escalation_triggers",
        "description": "Task-specific draft field: escalation triggers"
      },
      {
        "name": "missing_facts",
        "description": "Task-specific draft field: missing facts"
      }
    ],
    "forbidden_actions": [
      "No legal advice, final legal determination, certification, audit opinion, regulatory filing, signature, external communication or binding company decision.",
      "No invented law, facts, company policy, thresholds, dates, approvals, jurisdiction or evidence.",
      "No external effect, system mutation, notification, submission, publication, record closure, production or deletion.",
      "No source scripts, shell commands, APIs or connector aliases are callable task tools.",
      "No unnecessary sensitive, personal, confidential or privileged content in task state or output."
    ],
    "verification_steps": [
      "Trace material claims to authorized evidence and pinpoint.",
      "Verify jurisdiction/current primary authority or label as unknown.",
      "Validate typed output and keep external effects/mutations empty.",
      "Use only current native tools visible in the runtime; no scripts or invented APIs."
    ],
    "completion_criteria": [
      "Task-specific draft matches contract and acceptance conditions.",
      "Evidence, uncertainty, applicability and owner decisions are visible.",
      "No unapproved external effects, system changes or unsupported legal claims.",
      "A completed_draft populates the non-empty task-specific fields in references/task-contract-shape-fixture.json and cites evidence.",
      "A needs_context response records missing_inputs, unknown_facts and any separable partial_work without fabricating completion."
    ],
    "known_limitations": [
      "Structural validation is not semantic, legal, audit or runtime certification.",
      "Pack remains draft, uncertified, unadmitted and unpublished."
    ]
  },
  "dependencies": {
    "schema_version": "0.1",
    "skill_dependencies": [],
    "packaged_tools": [],
    "host_capabilities": [
      "filesystem_read",
      "filesystem_write"
    ],
    "external_services": [],
    "library_assets": [],
    "runtime_requirements": [
      {
        "key": "min_reasoning_tier",
        "value": "balanced"
      },
      {
        "key": "context_required",
        "value": 64000
      },
      {
        "key": "preferred_model",
        "value": "gpt-6.1-sol"
      }
    ],
    "optional_dependencies": []
  },
  "eval": {
    "suite_path": "references/eval-suite.json",
    "suite_schema_version": "0.1",
    "required_certification_profiles": [],
    "verification_refs": [
      "references/eval-suite.yaml",
      "references/upstream/SOURCE-MANIFEST.json",
      "references/task-contract-shape-fixture.json"
    ],
    "suite_hash": "sha256:d642cd5b60708d47ba4c3edf2a930fb234028d3c9845f80f8c7c788e120cd5d3"
  },
  "telemetry": {
    "classification": "restricted",
    "redaction_rules": [
      "strip_secrets",
      "strip_personal_data",
      "strip_privileged_content",
      "strip_raw_documents",
      "strip_reasoning"
    ],
    "retention_policy": "retain opaque task/source ids and hashes only"
  },
  "fragments": [
    {
      "fragment_id": "skill-md",
      "disclosure_level": 2,
      "path": "SKILL.md"
    },
    {
      "fragment_id": "advanced",
      "disclosure_level": 3,
      "path": "advanced/advanced.md"
    },
    {
      "fragment_id": "contracts",
      "disclosure_level": 4,
      "path": "references/schemas.json"
    },
    {
      "fragment_id": "eval",
      "disclosure_level": 4,
      "path": "references/eval-suite.json"
    },
    {
      "fragment_id": "source-manifest",
      "disclosure_level": 3,
      "path": "references/upstream/SOURCE-MANIFEST.json"
    }
  ],
  "release_channel": "development"
}
