{
  "schema_version": "0.1",
  "skill_id": "plan-eng-review",
  "display_name": "plan-eng-review",
  "version": "1.0.0",
  "description": "Engineering-manager review of the plan that writes the test plan Verification will read.",
  "capability_category": "internal_launch",
  "lifecycle_state": "draft",
  "format_profile": "simple",
  "compatible_runtime_profiles": [
    "cursor-macos"
  ],
  "min_capability_tier": "high",
  "routing": {
    "when_to_use": "Engineering-manager review of the plan that writes the test plan Verification will read.",
    "when_not_to_use": [
      "Do not claim usable or live",
      "Do not grant permission-to-act"
    ],
    "tags": [
      "hybrid",
      "draft"
    ]
  },
  "execution": {
    "required_inputs": [
      {
        "name": "task",
        "description": "Operator task"
      }
    ],
    "expected_outputs": [
      {
        "name": "result",
        "description": "Procedure result"
      }
    ],
    "forbidden_actions": [
      "Publish as live",
      "Print secrets"
    ],
    "verification_steps": [
      "Validate input contract",
      "Follow SKILL.md"
    ],
    "completion_criteria": [
      "Draft procedure followed",
      "No live claim"
    ]
  },
  "dependencies": {
    "schema_version": "0.1",
    "skill_dependencies": [],
    "packaged_tools": [],
    "host_capabilities": [
      "filesystem_read",
      "filesystem_write"
    ],
    "external_services": [],
    "library_assets": [],
    "runtime_requirements": [],
    "optional_dependencies": []
  },
  "eval": {
    "suite_path": "references/eval-suite.json",
    "suite_schema_version": "0.1",
    "suite_hash": "sha256:97543b4056421b8b6077a913d79aa82582d08692374fce1e0d16aed6d76d2cf9"
  },
  "telemetry": {
    "classification": "public_internal",
    "redaction_rules": [
      "strip_secrets",
      "strip_private_data",
      "strip_reasoning"
    ],
    "retention_policy": "retain_ids_and_hashes"
  },
  "fragments": [
    {
      "fragment_id": "summary",
      "disclosure_level": 2,
      "path": "SKILL.md"
    }
  ],
  "release_channel": "eval"
}
